{
  "id": "code_quality.lesson_style",
  "category": "code_quality",
  "severity": "P2",
  "status": "candidate",
  "title": "섹션 단위(.단위)로 천천히 자세히 진행, plan 모드에서 수업 가능",
  "failure_mode": "수업은 챕터의 소수점 단위 섹션(6.1, 6.2, 6.3.2 등)으로 하나씩 천천히 자세하게 진행한다.\n\n**Why:** 학생이 2026-03-30에 \"chapter 6.2 이런식으로 .단위로 천천히 자세히 나가자\"고 명시적으로 요청함. plan 모드에서도 수업 진행 가능하다고 확인.\n**How to apply:** 한 섹션 설명 → 이해 확인 → 다음 섹션으로 넘어가는 흐름. 여러 섹션을 한꺼번에 몰아서 설명하지 않기.",
  "detection": {
    "surfaces": [],
    "signals": [],
    "signal_type": "pending_review",
    "precision": "unknown",
    "cost": "unknown"
  },
  "prevention": {
    "action": "observe",
    "message": "imported from feedback memory — needs curation"
  },
  "solution": {
    "canonical_fix": "수업은 챕터의 소수점 단위 섹션(6.1, 6.2, 6.3.2 등)으로 하나씩 천천히 자세하게 진행한다.\n\n**Why:** 학생이 2026-03-30에 \"chapter 6.2 이런식으로 .단위로 천천히 자세히 나가자\"고 명시적으로 요청함. plan 모드에서도 수업 진행 가능하다고 확인.\n**How to apply:** 한 섹션 설명 → 이해 확인 → 다음 섹션으로 넘어가는 흐름. 여러 섹션을 한꺼번에 몰아서 설명하지 않기.",
    "verification": []
  },
  "stats": {
    "occurrences_30d": 0,
    "distinct_sessions_30d": 0,
    "last_seen": null,
    "false_positive_rate": null,
    "escape_rate": null,
    "prevented_count": 0
  },
  "promotion": {
    "state": "candidate",
    "target": "pending_review",
    "reason": "자동 import — 큐레이션 팀 리뷰 필요"
  },
  "provenance": {
    "original_memory": "projects/-Users-kimtaekyu-Documents-Develop-Fold-Secret-Study-Langchain-Guide/memory/feedback_lesson_style.md",
    "created": "2026-05-11",
    "last_modified": "2026-05-11",
    "created_by": "import_feedback_memories.py"
  }
}
