{
  "id": "verification.thorough_verification",
  "category": "verification",
  "severity": "P2",
  "status": "candidate",
  "title": "순차작업 시 매 단계 다각도 검증 필수, 메모리 유실/작업 누락 절대 금지",
  "failure_mode": "순차작업 시 검증을 확실하게, 치밀하게, 다각도로 수행.\n\n- 설계 관련 작업은 특히 치밀한 다각도 검증 필수\n- 메모리 날아가거나 작업 덜하는 문제 절대 없어야 함\n- 각 Phase 완료 시 코덱스 검증 체크리스트 전항목 자체 확인\n- 컨텍스트 압축으로 작업 내용 유실되지 않도록 핵심 정보 항상 보존\n\n**Why:** 사용자가 순차적으로 중요한 설계 작업을 진행 중이며, 불완전한 구현이나 검증 누락은 후속 Phase에 치명적 영향.\n**How to apply:** 매 구현 완료 시 체크리스트 전항목 검증 에이전트 반드시 스폰. 검증 실패 시 즉시 수정 후 재검증.",
  "detection": {
    "surfaces": [],
    "signals": [],
    "signal_type": "pending_review",
    "precision": "unknown",
    "cost": "unknown"
  },
  "prevention": {
    "action": "observe",
    "message": "imported from feedback memory — needs curation"
  },
  "solution": {
    "canonical_fix": "순차작업 시 검증을 확실하게, 치밀하게, 다각도로 수행.\n\n- 설계 관련 작업은 특히 치밀한 다각도 검증 필수\n- 메모리 날아가거나 작업 덜하는 문제 절대 없어야 함\n- 각 Phase 완료 시 코덱스 검증 체크리스트 전항목 자체 확인\n- 컨텍스트 압축으로 작업 내용 유실되지 않도록 핵심 정보 항상 보존\n\n**Why:** 사용자가 순차적으로 중요한 설계 작업을 진행 중이며, 불완전한 구현이나 검증 누락은 후속 Phase에 치명적 영향.\n**How to apply:** 매 구현 완료 시 체크리스트 전항목 검증 에이전트 반드시 스폰. 검증 실패 시 즉시 수정 후 재검증.",
    "verification": []
  },
  "stats": {
    "occurrences_30d": 0,
    "distinct_sessions_30d": 0,
    "last_seen": null,
    "false_positive_rate": null,
    "escape_rate": null,
    "prevented_count": 0
  },
  "promotion": {
    "state": "candidate",
    "target": "pending_review",
    "reason": "자동 import — 큐레이션 팀 리뷰 필요"
  },
  "provenance": {
    "original_memory": "projects/-Users-kimtaekyu-Documents-Develop-Fold-Secret-Project-MacBot/memory/feedback_thorough_verification.md",
    "created": "2026-05-11",
    "last_modified": "2026-05-11",
    "created_by": "import_feedback_memories.py"
  }
}
