{
  "id": "code_quality.odap_workflow",
  "category": "code_quality",
  "severity": "P2",
  "status": "candidate",
  "title": "코딩테스트 문제는 Claude가 정리. 모든 시도 코드 전체 수록 필수. 상세 규칙은 rules/coding-test/ 참조.",
  "failure_mode": "## 코딩테스트 문제 정리 핵심\n\n사용자가 틀린 문제를 가져오면 Claude가 직접 문제 노트를 작성한다.\n\n**Why:** 사용자가 나중에 공통 실수 패턴 분석을 위해 코드를 모을 예정. 코드가 요약/생략되면 분석 불가.\n\n**How to apply:**\n1. `rules/coding-test/README.md` → `problem-note.md` 순서로 읽고 규칙 따름\n2. `📋 템플릿/코딩테스트 문제.md` 구조 준수\n3. **모든 시도의 코드 전체를 반드시 수록** (요약/생략 절대 금지)\n4. 기존 문제 노트들의 `실수패턴`을 확인해서 반복 패턴 여부 진단\n5. AI 코칭: 실수 패턴 진단 + 추가 공부 추천 + 연습 문제 추천",
  "detection": {
    "surfaces": [],
    "signals": [],
    "signal_type": "pending_review",
    "precision": "unknown",
    "cost": "unknown"
  },
  "prevention": {
    "action": "observe",
    "message": "imported from feedback memory — needs curation"
  },
  "solution": {
    "canonical_fix": "## 코딩테스트 문제 정리 핵심\n\n사용자가 틀린 문제를 가져오면 Claude가 직접 문제 노트를 작성한다.\n\n**Why:** 사용자가 나중에 공통 실수 패턴 분석을 위해 코드를 모을 예정. 코드가 요약/생략되면 분석 불가.\n\n**How to apply:**\n1. `rules/coding-test/README.md` → `problem-note.md` 순서로 읽고 규칙 따름\n2. `📋 템플릿/코딩테스트 문제.md` 구조 준수\n3. **모든 시도의 코드 전체를 반드시 수록** (요약/생략 절대 금지)\n4. 기존 문제 노트들의 `실수패턴`을 확인해서 반복 패턴 여부 진단\n5. AI 코칭: 실수 패턴 진단 + 추가 공부 추천 + 연습 문제 추천",
    "verification": []
  },
  "stats": {
    "occurrences_30d": 0,
    "distinct_sessions_30d": 0,
    "last_seen": null,
    "false_positive_rate": null,
    "escape_rate": null,
    "prevented_count": 0
  },
  "promotion": {
    "state": "candidate",
    "target": "pending_review",
    "reason": "자동 import — 큐레이션 팀 리뷰 필요"
  },
  "provenance": {
    "original_memory": "projects/-Users-kimtaekyu-Documents-Obsidian-Vault/memory/feedback_odap_workflow.md",
    "created": "2026-05-11",
    "last_modified": "2026-05-11",
    "created_by": "import_feedback_memories.py"
  }
}
