{
  "id": "ux_consistency.quality_standards",
  "category": "ux_consistency",
  "severity": "P2",
  "status": "candidate",
  "title": "사용자는 사소한 UI 오류나 앱 크래시에 대해 제로 톨러런스 — 안전장치와 2티어 구조를 요구함",
  "failure_mode": "사소한 오류에도 앱이 죽거나 잘못된 동작을 하면 안 된다. \"이런 잔오류 없어야해.\"\n\n**Why:** 사용자가 \"지금 실행\" 버튼을 눌렀을 때 앱 자체가 사라진 경험이 있음. 환경 오류(uv not found)로 에러 다이얼로그만 나오는 것도 불만족. 환경+서버 부분에 2티어 안전장치를 명시적으로 요구함.\n\n**How to apply:**\n- 모든 프로세스 실행에 2티어 안전 구조 적용 (환경 해석 fallback + 프로세스 수명 관리)\n- mounted 체크, context.mounted 체크 등 비동기 상태 변경 전 항상 유효성 확인\n- 에러는 잡되 삼키지 말고, 사용자에게 읽기 쉬운 메시지로 전달\n- macOS GUI 앱은 쉘 PATH를 상속받지 못하므로 바이너리 경로를 명시적으로 탐색해야 함",
  "detection": {
    "surfaces": [],
    "signals": [],
    "signal_type": "pending_review",
    "precision": "unknown",
    "cost": "unknown"
  },
  "prevention": {
    "action": "observe",
    "message": "imported from feedback memory — needs curation"
  },
  "solution": {
    "canonical_fix": "사소한 오류에도 앱이 죽거나 잘못된 동작을 하면 안 된다. \"이런 잔오류 없어야해.\"\n\n**Why:** 사용자가 \"지금 실행\" 버튼을 눌렀을 때 앱 자체가 사라진 경험이 있음. 환경 오류(uv not found)로 에러 다이얼로그만 나오는 것도 불만족. 환경+서버 부분에 2티어 안전장치를 명시적으로 요구함.\n\n**How to apply:**\n- 모든 프로세스 실행에 2티어 안전 구조 적용 (환경 해석 fallback + 프로세스 수명 관리)\n- mounted 체크, context.mounted 체크 등 비동기 상태 변경 전 항상 유효성 확인\n- 에러는 잡되 삼키지 말고, 사용자에게 읽기 쉬운 메시지로 전달\n- macOS GUI 앱은 쉘 PATH를 상속받지 못하므로 바이너리 경로를 명시적으로 탐색해야 함",
    "verification": []
  },
  "stats": {
    "occurrences_30d": 0,
    "distinct_sessions_30d": 0,
    "last_seen": null,
    "false_positive_rate": null,
    "escape_rate": null,
    "prevented_count": 0
  },
  "promotion": {
    "state": "candidate",
    "target": "pending_review",
    "reason": "자동 import — 큐레이션 팀 리뷰 필요"
  },
  "provenance": {
    "original_memory": "projects/-Users-kimtaekyu-Documents-Develop-Fold-Secret-Project-send-IT-News/memory/feedback_quality_standards.md",
    "created": "2026-05-11",
    "last_modified": "2026-05-11",
    "created_by": "import_feedback_memories.py"
  }
}
