{
  "id": "code_quality.workflow",
  "category": "code_quality",
  "severity": "P2",
  "status": "candidate",
  "title": "메모 정리 시 반드시 제안 먼저 하고 승인 후 실행하는 방식 선호",
  "failure_mode": "메모 정리는 항상 제안 → 승인 → 실행 순서로 진행할 것.\n\n**Why:** 사용자가 직접 선택지에서 고르거나 승인하는 방식을 명시적으로 요청함. 자동 정리 금지.\n**How to apply:** inbox에 메모가 들어오면 어디로 옮길지, 장단점이 뭔지 먼저 설명하고 사용자가 고른 뒤 실행.\n\n**예외 — 직접 실행 가능한 경우:**\n- 사용자가 \"inbox에 넣어놨어, 정리해서 넣어줘\" 처럼 목적지를 명시하거나 작업을 명확히 지정한 경우\n- 오답노트/코딩테스트 관련 내용처럼 이동 위치가 명백한 경우\n- 이 경우는 바로 실행해도 됨 (제안 없이)",
  "detection": {
    "surfaces": [],
    "signals": [],
    "signal_type": "pending_review",
    "precision": "unknown",
    "cost": "unknown"
  },
  "prevention": {
    "action": "observe",
    "message": "imported from feedback memory — needs curation"
  },
  "solution": {
    "canonical_fix": "메모 정리는 항상 제안 → 승인 → 실행 순서로 진행할 것.\n\n**Why:** 사용자가 직접 선택지에서 고르거나 승인하는 방식을 명시적으로 요청함. 자동 정리 금지.\n**How to apply:** inbox에 메모가 들어오면 어디로 옮길지, 장단점이 뭔지 먼저 설명하고 사용자가 고른 뒤 실행.\n\n**예외 — 직접 실행 가능한 경우:**\n- 사용자가 \"inbox에 넣어놨어, 정리해서 넣어줘\" 처럼 목적지를 명시하거나 작업을 명확히 지정한 경우\n- 오답노트/코딩테스트 관련 내용처럼 이동 위치가 명백한 경우\n- 이 경우는 바로 실행해도 됨 (제안 없이)",
    "verification": []
  },
  "stats": {
    "occurrences_30d": 0,
    "distinct_sessions_30d": 0,
    "last_seen": null,
    "false_positive_rate": null,
    "escape_rate": null,
    "prevented_count": 0
  },
  "promotion": {
    "state": "candidate",
    "target": "pending_review",
    "reason": "자동 import — 큐레이션 팀 리뷰 필요"
  },
  "provenance": {
    "original_memory": "projects/-Users-kimtaekyu-Documents-Obsidian-Vault/memory/feedback_workflow.md",
    "created": "2026-05-11",
    "last_modified": "2026-05-11",
    "created_by": "import_feedback_memories.py"
  }
}
