{
  "id": "code_quality.coding_test",
  "category": "code_quality",
  "severity": "P2",
  "status": "candidate",
  "title": "코딩테스트 Python 폴더는 자료가 들어올 때 내부 구조를 만듦 - 미리 세분화하지 않음",
  "failure_mode": "코딩테스트 Python 폴더의 하위 구조는 미리 만들지 않는다. 자료를 받을 때 그때 적절한 구조를 제안하고 만든다.\n\n**Why:** 사용자가 이미 정리해둔 자료가 있어서 그 형태에 맞춰야 함. 빈 폴더를 미리 만드는 것은 불필요.\n**How to apply:** 사용자가 코딩테스트 자료를 주면 내용을 분석하고 그에 맞는 폴더/태그 구조를 제안한 뒤 승인받고 생성.",
  "detection": {
    "surfaces": [],
    "signals": [],
    "signal_type": "pending_review",
    "precision": "unknown",
    "cost": "unknown"
  },
  "prevention": {
    "action": "observe",
    "message": "imported from feedback memory — needs curation"
  },
  "solution": {
    "canonical_fix": "코딩테스트 Python 폴더의 하위 구조는 미리 만들지 않는다. 자료를 받을 때 그때 적절한 구조를 제안하고 만든다.\n\n**Why:** 사용자가 이미 정리해둔 자료가 있어서 그 형태에 맞춰야 함. 빈 폴더를 미리 만드는 것은 불필요.\n**How to apply:** 사용자가 코딩테스트 자료를 주면 내용을 분석하고 그에 맞는 폴더/태그 구조를 제안한 뒤 승인받고 생성.",
    "verification": []
  },
  "stats": {
    "occurrences_30d": 0,
    "distinct_sessions_30d": 0,
    "last_seen": null,
    "false_positive_rate": null,
    "escape_rate": null,
    "prevented_count": 0
  },
  "promotion": {
    "state": "candidate",
    "target": "pending_review",
    "reason": "자동 import — 큐레이션 팀 리뷰 필요"
  },
  "provenance": {
    "original_memory": "projects/-Users-kimtaekyu-Documents-Obsidian-Vault/memory/feedback_coding_test.md",
    "created": "2026-05-11",
    "last_modified": "2026-05-11",
    "created_by": "import_feedback_memories.py"
  }
}
