{
  "id": "ux_consistency.langchain_version",
  "category": "ux_consistency",
  "severity": "P2",
  "status": "candidate",
  "title": "항상 LangChain 1.0 (2025.09 리라이트) + 2026년 최신 기준으로 설명할 것. 레거시 패턴 사용 금지.",
  "failure_mode": "항상 LangChain 1.0 (2025.09 리라이트 버전)과 2026년 기준 최신 버전으로 설명한다.\n\n**Why:** 질답 선생님이 `create_react_agent`의 import 경로를 레거시(`langgraph.prebuilt`) 기준으로 잘못 안내함. 교재는 LangChain 1.0 기준이며, `from langchain.agents import create_react_agent`가 표준 경로.\n\n**How to apply:**\n- `langchain.agents.create_react_agent`이 표준 (langgraph.prebuilt는 deprecated)\n- `{\"messages\": [...]}` 패턴으로 바로 invoke 가능 (AgentExecutor 불필요)\n- 과외/질답 선생님 Agent 호출 시 프롬프트에 \"LangChain 1.0 (2026) 기준으로만 설명\" 명시 필수\n- 레거시 패턴(AgentExecutor, langgraph.prebuilt 등",
  "detection": {
    "surfaces": [],
    "signals": [],
    "signal_type": "pending_review",
    "precision": "unknown",
    "cost": "unknown"
  },
  "prevention": {
    "action": "observe",
    "message": "imported from feedback memory — needs curation"
  },
  "solution": {
    "canonical_fix": "항상 LangChain 1.0 (2025.09 리라이트 버전)과 2026년 기준 최신 버전으로 설명한다.\n\n**Why:** 질답 선생님이 `create_react_agent`의 import 경로를 레거시(`langgraph.prebuilt`) 기준으로 잘못 안내함. 교재는 LangChain 1.0 기준이며, `from langchain.agents import create_react_agent`가 표준 경로.\n\n**How to apply:**\n- `langchain.agents.create_react_agent`이 표준 (langgraph.prebuilt는 deprecated)\n- `{\"messages\": [...]}` 패턴으로 바로 invoke 가능 (AgentExecutor 불필요)\n- 과외/질답 선생님 Agent 호출 시 프롬프트에 \"LangChain 1.0 (2026) 기준으로만 설명\" 명시 필수\n- 레거시 패턴(AgentExecutor, langgraph.prebuilt 등",
    "verification": []
  },
  "stats": {
    "occurrences_30d": 0,
    "distinct_sessions_30d": 0,
    "last_seen": null,
    "false_positive_rate": null,
    "escape_rate": null,
    "prevented_count": 0
  },
  "promotion": {
    "state": "candidate",
    "target": "pending_review",
    "reason": "자동 import — 큐레이션 팀 리뷰 필요"
  },
  "provenance": {
    "original_memory": "projects/-Users-kimtaekyu-Documents-Develop-Fold-Secret-Study-Langchain-Guide/memory/feedback_langchain_version.md",
    "created": "2026-05-11",
    "last_modified": "2026-05-11",
    "created_by": "import_feedback_memories.py"
  }
}
