{
  "id": "scope_control.no_workaround_strict",
  "category": "scope_control",
  "severity": "P2",
  "status": "candidate",
  "title": "우회 절대 금지, 정석 진행 엄수 — 9시간 장기 테스트 세션에서 사용자가 재차 강조",
  "failure_mode": "테스트 실행 및 모든 작업에서 우회(workaround) 절대 금지.\n\n**Why:** 사용자가 9시간 장기 자동 테스트 세션(2026-05-07) 시작 시 \"우회 절대하지 말고, 정석적으로 내 의도와 설계에 맞게 해야해\"라고 재차 강조. 이전에도 CLAUDE.md에 \"No Workarounds — Proper Integration Required\" 원칙이 있었지만, 이번에 실행 단계에서 다시 한번 못 박음.\n\n**How to apply:**\n- config 수정 시 주석 해제나 임시값 대신 정확한 설정값 적용\n- 테스트 실패 시 mock/fake로 우회하지 않고 근본 원인 해결\n- 모델 연결 실패 시 fallback 대신 원인 파악 후 재시도\n- 9시간 자동 운영 중에도 이 원칙 위반 시 즉시 중단 후 정석 경로로 복구",
  "detection": {
    "surfaces": [],
    "signals": [],
    "signal_type": "pending_review",
    "precision": "unknown",
    "cost": "unknown"
  },
  "prevention": {
    "action": "observe",
    "message": "imported from feedback memory — needs curation"
  },
  "solution": {
    "canonical_fix": "테스트 실행 및 모든 작업에서 우회(workaround) 절대 금지.\n\n**Why:** 사용자가 9시간 장기 자동 테스트 세션(2026-05-07) 시작 시 \"우회 절대하지 말고, 정석적으로 내 의도와 설계에 맞게 해야해\"라고 재차 강조. 이전에도 CLAUDE.md에 \"No Workarounds — Proper Integration Required\" 원칙이 있었지만, 이번에 실행 단계에서 다시 한번 못 박음.\n\n**How to apply:**\n- config 수정 시 주석 해제나 임시값 대신 정확한 설정값 적용\n- 테스트 실패 시 mock/fake로 우회하지 않고 근본 원인 해결\n- 모델 연결 실패 시 fallback 대신 원인 파악 후 재시도\n- 9시간 자동 운영 중에도 이 원칙 위반 시 즉시 중단 후 정석 경로로 복구",
    "verification": []
  },
  "stats": {
    "occurrences_30d": 0,
    "distinct_sessions_30d": 0,
    "last_seen": null,
    "false_positive_rate": null,
    "escape_rate": null,
    "prevented_count": 0
  },
  "promotion": {
    "state": "candidate",
    "target": "pending_review",
    "reason": "자동 import — 큐레이션 팀 리뷰 필요"
  },
  "provenance": {
    "original_memory": "projects/-Users-kimtaekyu-Documents-Develop-Fold-Secret-Project-MacBot/memory/feedback_no_workaround_strict.md",
    "created": "2026-05-11",
    "last_modified": "2026-05-11",
    "created_by": "import_feedback_memories.py"
  }
}
